{
  "phase": 11,
  "phase_name": "self-healing-infrastructure",
  "status": "complete",
  "started_at": "2026-02-24T00:15:00Z",
  "wave": 2,
  "total_waves": 2,
  "correlation_id": "cc464cc1-14d2-449b-9ad9-527736c00e2e",
  "plans": [
    {
      "id": "11-01",
      "title": "MCP Tool Retry with Exponential Backoff and Circuit Breaker",
      "wave": 1,
      "status": "complete"
    },
    {
      "id": "11-02",
      "title": "Atomic File Writes with Checksum Validation",
      "wave": 1,
      "status": "complete"
    },
    {
      "id": "11-03",
      "title": "Command Execution Timeouts",
      "wave": 1,
      "status": "complete"
    },
    {
      "id": "11-04",
      "title": "Task Lease TTL with Auto-Reassignment",
      "wave": 1,
      "status": "complete"
    },
    {
      "id": "11-05",
      "title": "Enable Recovery Feature Flags and Integration Verification",
      "wave": 2,
      "status": "complete"
    }
  ],
  "completed_at": "2026-02-24T00:45:00Z"
}
